{
  "operationId": "950",
  "transactionCode": "69",
  "result": "0",
  "customerId": "",
  "errorMessage": "null",
  "registrationDate": "",
  "customer": "abc",
  "customerLogin": "",
  "customerTitle": "Mr",
  "customerFirstName": "Abc",
  "customerMiddleName" : "foo",
  "customerLastName" : "bar",
   "customerGender" : "male",
   "customerBirthdate" : "21-12-1990",
   "customerAddress" : "abc",
   "customerCity" : "xyz",
   "customerProvince" : "xyz",
   "customerCounty" : "xyz",
   "customerCountry" : "UK",
   "customerPostalCode" : "xyz",
   "customerPhone" : "xyz",
   "customerDiscount" : "xyz",
   "promotionOptIn" : "",
   "customerEmail" : "abc@xyz.com", 
   "customerMobile" : "",
   "customerCompany" : "",
   "messageType" : "", 
   "messageDeliveryMethod" : ""
   
}
